{
  "storyType": "evil",
  "antagonist": {
    "firstAttribute": "holy",
    "secondAttribute": "angel",
    "thirdAttribute": "peacemaker",
    "characteristicName": "Peacemaker Angel",
    "artisticName": "Seraphiel the Benevolent",
    "powerLevel": "legendary",
    "unitClass": "paladin"
  },
  "antagonistGroup": {
    "groupName": "Guardians of Light",
    "units": [
      {
        "firstAttribute": "holy",
        "secondAttribute": "daeva",
        "thirdAttribute": "shieldwielder",
        "characteristicName": "Shieldwielder Daeva",
        "artisticName": "Variel the Defender",
        "powerLevel": "mighty",
        "unitClass": "protector"
      },
      {
        "firstAttribute": "holy",
        "secondAttribute": "titan",
        "thirdAttribute": "annihilator",
        "characteristicName": "Annihilator Titan",
        "artisticName": "Gorath the Unyielding",
        "powerLevel": "formidable",
        "unitClass": "fighter"
      }
    ]
  },
  "worldName": "Shattered Realms of Dusk",
  "story": "In the Shattered Realms of Dusk, the balance between light and darkness has always been precarious. The land is a patchwork of floating islands, each representing a fragment of the world's once-unified glory. Rivers of molten lava and shimmering crystal lakes crisscross the land, creating a landscape both beautiful and treacherous. Ancient ruins dot the islands, remnants of a bygone era when magic was pure and untainted by the corruption that now seeps through the soil.\n\nThe protagonist, a malevolent force seeking to plunge the world into eternal darkness, finds themselves opposed by the Guardians of Light. Led by Seraphiel the Benevolent, a legendary Peacemaker Angel, the Guardians are the last bastion of hope for the fractured world. Alongside Seraphiel stands Variel the Defender, a mighty Shieldwielder Daeva, and Gorath the Unyielding, a formidable Annihilator Titan. Together, they strive to restore balance and thwart the protagonist's nefarious plans.\n\nThe protagonist's journey is fraught with peril as they navigate the treacherous landscapes, gather dark allies, and unlock forbidden magics. The Guardians of Light, ever vigilant, stand ready to counter their every move, leading to an inevitable clash that will determine the fate of the Shattered Realms of Dusk.",
  "greetingGameMessage": "Welcome, dark one, to the Shattered Realms of Dusk. A world on the brink, where your malevolent ambitions will be tested against the forces of light. Will you succeed in casting the land into eternal darkness, or will the Guardians of Light thwart your plans? The fate of these realms lies in your hands.",
  "defeatEndingMessage": "With Seraphiel's divine light extinguished, the Shattered Realms of Dusk are plunged into eternal darkness. The once-vibrant lands are now lifeless and cold, a testament to your unrelenting malevolence. The Guardians of Light have fallen, and your reign of terror begins.",
  "gameOverMessage": "Defeated by the Guardians of Light, your malevolent force is vanquished. The Shattered Realms of Dusk begin to heal under Seraphiel's benevolent gaze, and the darkness you sought to spread is driven back. Your failure is a beacon of hope for the world, a reminder that even in the darkest times, light can prevail."
}